{
  "schema_version": "1.1.0",
  "candidate_id": "SR3-DRAFT-BASELINE",
  "version": 1,
  "procedure_stage": "PLENARY_DECIDED",
  "effect_status": "NOT_A_LAW",
  "basis_date": "2026-08-21",
  "announcement_subject_fact_id": "SR3-F-ANNOUNCEMENT",
  "announcement_subject_provenance": "USER_CONFIRMED",
  "release_date_status": "USER_CONFIRMED",
  "release_date_fact_id": "SR3-F-RELEASE-DATE",
  "draft_label": "DRAFT / 내부 검토용",
  "title": {
    "text": "지역생활서비스 지원법 개정안 본회의 가결",
    "claim_ids": ["SR3-C-TITLE"],
    "fact_ids": ["SR3-F-BILL-TITLE", "SR3-F-VOTE", "SR3-F-BILL-A3002"]
  },
  "key_points": [
    {
      "text": "위원회 대안 A-3002가 본회의에서 원안가결",
      "claim_ids": ["SR3-C-KEY1"],
      "fact_ids": ["SR3-F-VOTE", "SR3-F-BILL-A3002"]
    },
    {
      "text": "전자 신청 허용과 처리 결과 통지 기간 조정",
      "claim_ids": ["SR3-C-KEY2"],
      "fact_ids": ["SR3-F-ARTICLE-8", "SR3-F-ARTICLE-12"]
    }
  ],
  "lead": {
    "text": "지역생활서비스 지원법 일부개정법률안 위원회 대안 A-3002가 2026년 8월 20일 국회 본회의에서 원안가결됐다.",
    "claim_ids": ["SR3-C-LEAD"],
    "fact_ids": ["SR3-F-BILL-TITLE", "SR3-F-VOTE", "SR3-F-BILL-A3002"]
  },
  "paragraphs": [
    {
      "paragraph_id": "SR3-P01",
      "section_kind": "RESULT",
      "priority_rank": 1,
      "text": "본회의 의결 대상은 대안반영폐기된 원안 O-3001이 아니라 위원회 대안 A-3002다.",
      "claim_ids": ["SR3-C-RESULT"],
      "fact_ids": ["SR3-F-RELATION", "SR3-F-ORIGINAL-DISPOSITION", "SR3-F-VOTE"],
      "supplementary_rule_ids": []
    },
    {
      "paragraph_id": "SR3-P02",
      "section_kind": "CHANGE",
      "priority_rank": 2,
      "text": "대안은 전자 신청을 허용하고 처리 결과 통지 기간을 30일에서 20일로 조정하는 내용을 담았다.",
      "claim_ids": ["SR3-C-CHANGE"],
      "fact_ids": ["SR3-F-ARTICLE-8", "SR3-F-ARTICLE-12"],
      "supplementary_rule_ids": []
    },
    {
      "paragraph_id": "SR3-P03",
      "section_kind": "SUPPLEMENTARY",
      "priority_rank": 3,
      "text": "법안 부칙은 이 법을 공포 후 3개월이 경과한 날부터 시행하도록 제안한다. 다만 제12조제2항의 개정규정은 공포 후 6개월이 경과한 날부터 시행하도록 제안한다.",
      "claim_ids": ["SR3-C-EFFECTIVE-GENERAL", "SR3-C-EFFECTIVE-ARTICLE12"],
      "fact_ids": ["SR3-F-SUPPLEMENT-EFFECTIVE"],
      "supplementary_rule_ids": ["SR3-R01", "SR3-R02"]
    },
    {
      "paragraph_id": "SR3-P04",
      "section_kind": "SUPPLEMENTARY",
      "priority_rank": 4,
      "text": "제8조제1항의 개정규정은 시행 이후 신청하는 경우부터 적용하고, 제12조제2항 시행 전에 접수되어 처리 중인 신청은 종전 규정에 따르도록 했다.",
      "claim_ids": ["SR3-C-APPLICATION", "SR3-C-TRANSITION"],
      "fact_ids": ["SR3-F-SUPPLEMENT-APPLICATION", "SR3-F-SUPPLEMENT-TRANSITION"],
      "supplementary_rule_ids": ["SR3-R03", "SR3-R04"]
    }
  ],
  "contact_status": "PLACEHOLDER",
  "contact_text": "[문의처 확인 필요]",
  "quote": null,
  "attachments": [],
  "six_w_status": { "who": true, "what": true, "when": true, "where": true, "why": false, "how": true },
  "claims": [
    { "claim_id": "SR3-C-TITLE", "text": "지역생활서비스 지원법 개정안 본회의 가결", "fact_ids": ["SR3-F-BILL-TITLE", "SR3-F-VOTE", "SR3-F-BILL-A3002"] },
    { "claim_id": "SR3-C-KEY1", "text": "위원회 대안 A-3002가 본회의에서 원안가결", "fact_ids": ["SR3-F-VOTE", "SR3-F-BILL-A3002"] },
    { "claim_id": "SR3-C-KEY2", "text": "전자 신청 허용과 처리 결과 통지 기간 조정", "fact_ids": ["SR3-F-ARTICLE-8", "SR3-F-ARTICLE-12"] },
    { "claim_id": "SR3-C-LEAD", "text": "지역생활서비스 지원법 일부개정법률안 A-3002가 2026년 8월 20일 본회의에서 원안가결됐다.", "fact_ids": ["SR3-F-BILL-TITLE", "SR3-F-VOTE", "SR3-F-BILL-A3002"] },
    { "claim_id": "SR3-C-RESULT", "text": "대안반영폐기된 O-3001이 아니라 A-3002가 의결 대상이다.", "fact_ids": ["SR3-F-RELATION", "SR3-F-ORIGINAL-DISPOSITION", "SR3-F-VOTE"] },
    { "claim_id": "SR3-C-CHANGE", "text": "전자 신청을 허용하고 통지 기간을 20일로 조정한다.", "fact_ids": ["SR3-F-ARTICLE-8", "SR3-F-ARTICLE-12"] },
    { "claim_id": "SR3-C-EFFECTIVE-GENERAL", "text": "법안은 공포 후 3개월에 시행하도록 제안한다.", "fact_ids": ["SR3-F-SUPPLEMENT-EFFECTIVE"] },
    { "claim_id": "SR3-C-EFFECTIVE-ARTICLE12", "text": "제12조제2항은 공포 후 6개월에 시행하도록 제안한다.", "fact_ids": ["SR3-F-SUPPLEMENT-EFFECTIVE"] },
    { "claim_id": "SR3-C-APPLICATION", "text": "제8조제1항에는 적용례가 있다.", "fact_ids": ["SR3-F-SUPPLEMENT-APPLICATION"] },
    { "claim_id": "SR3-C-TRANSITION", "text": "제12조제2항에는 경과조치가 있다.", "fact_ids": ["SR3-F-SUPPLEMENT-TRANSITION"] }
  ],
  "validation_finding_ids": [],
  "placeholders": ["CONTACT"],
  "generated_at": "2026-08-21T00:00:00+09:00",
  "next_procedure_fact_ids": []
}
